<?xml version="1.0"?>

<!DOCTYPE MODE SYSTEM "xmode.dtd">

<MODE>
	<PROPS>
		<PROPERTY NAME="lineComment" VALUE="#" />
	</PROPS>
	<RULES HIGHLIGHT_DIGITS="TRUE">
		<WHITESPACE> </WHITESPACE>
		<WHITESPACE>	</WHITESPACE>

		<EOL_SPAN TYPE="COMMENT1" AT_LINE_START="TRUE">#</EOL_SPAN>
		<MARK_PREVIOUS TYPE="KEYWORD1"
			AT_LINE_START="TRUE" EXCLUDE_MATCH="TRUE">=</MARK_PREVIOUS>
		<MARK_PREVIOUS TYPE="KEYWORD1"
			AT_LINE_START="TRUE" EXCLUDE_MATCH="TRUE">:</MARK_PREVIOUS>
		<!-- MessageFormat { ... } stuff -->
		<SPAN TYPE="KEYWORD3" NO_LINE_BREAK="TRUE">
			<BEGIN>{</BEGIN>
			<END>}</END>
		</SPAN>
	</RULES>
</MODE>
