<?xml version="1.0"?>

<!DOCTYPE MODE SYSTEM "xmode.dtd">

<MODE>
	<PROPS>
		<!-- the ; hack is there so that stuff like if(bob) fred();
		  -- does not indent the next line -->
		<PROPERTY NAME="indentPrevLine" VALUE="\s*(((if|while)\s*\(|else|case|default)[^;]*|for\s*\(.*)" />
		<!-- set this to 'true' if you want to use GNU coding style -->
		<PROPERTY NAME="doubleBracketIndent" VALUE="false" />
		<PROPERTY NAME="commentStart" VALUE="/*" />
		<PROPERTY NAME="commentEnd" VALUE="*/" />
		<PROPERTY NAME="lineComment" VALUE="--" />
		<PROPERTY NAME="noWordSep" VALUE="_" />
		<PROPERTY NAME="wordBreakChars" VALUE=",+-=&lt;&gt;/?^&amp;*" />
	</PROPS>
	<RULES ESCAPE="\" IGNORE_CASE="TRUE" HIGHLIGHT_DIGITS="TRUE">
		<!-- whitespace: (space and tab) -->
		<WHITESPACE> </WHITESPACE>
		<WHITESPACE>    </WHITESPACE>

		<!-- Documentation comment -->
		<SPAN TYPE="COMMENT2" DELEGATE="java::JAVADOC">
			<BEGIN>/**</BEGIN>
			<END>*/</END>
		</SPAN>

		<!-- C style comment -->
		<SPAN TYPE="COMMENT1">
			<BEGIN>/*</BEGIN>
			<END>*/</END>
		</SPAN>

		<SPAN TYPE="LITERAL1" NO_LINE_BREAK="TRUE">
			<BEGIN>"</BEGIN>
			<END>"</END>
		</SPAN>
		<SPAN TYPE="LITERAL1" NO_LINE_BREAK="TRUE">
			<BEGIN>'</BEGIN>
			<END>'</END>
		</SPAN>

		<EOL_SPAN TYPE="COMMENT1">--</EOL_SPAN>

		<SEQ TYPE="NULL">(</SEQ>
		<SEQ TYPE="NULL">)</SEQ>
		<SEQ TYPE="OPERATOR">=</SEQ>
		<SEQ TYPE="OPERATOR">!</SEQ>
		<SEQ TYPE="OPERATOR">&gt;=</SEQ>
		<SEQ TYPE="OPERATOR">&lt;=</SEQ>
		<SEQ TYPE="OPERATOR">+</SEQ>
		<SEQ TYPE="OPERATOR">-</SEQ>
		<SEQ TYPE="OPERATOR">/</SEQ>

		<!-- workaround to stop "*" from being colorized
		  -- in import statements. -->
		<SEQ TYPE="NULL">.*</SEQ>

		<SEQ TYPE="OPERATOR">*</SEQ>
		<SEQ TYPE="OPERATOR">&gt;</SEQ>
		<SEQ TYPE="OPERATOR">&lt;</SEQ>
		<SEQ TYPE="OPERATOR">%</SEQ>
		<SEQ TYPE="OPERATOR">&amp;</SEQ>
		<SEQ TYPE="OPERATOR">|</SEQ>
		<SEQ TYPE="OPERATOR">^</SEQ>
		<SEQ TYPE="OPERATOR">~</SEQ>
		<SEQ TYPE="OPERATOR">}</SEQ>
		<SEQ TYPE="OPERATOR">{</SEQ>
		<SEQ TYPE="NULL">.</SEQ>
		<SEQ TYPE="NULL">,</SEQ>
		<SEQ TYPE="NULL">;</SEQ>
		<SEQ TYPE="NULL">]</SEQ>
		<SEQ TYPE="NULL">[</SEQ>
		<SEQ TYPE="NULL">?</SEQ>
		<MARK_PREVIOUS TYPE="LABEL" EXCLUDE_MATCH="TRUE"
			AT_LINE_START="TRUE">:</MARK_PREVIOUS>
		<SEQ TYPE="NULL">:</SEQ>

		<KEYWORDS IGNORE_CASE="TRUE">
			<KEYWORD1>abbrev</KEYWORD1>
			<KEYWORD1>abs</KEYWORD1>
			<KEYWORD1>b2x</KEYWORD1>
			<KEYWORD1>case</KEYWORD1>
			<KEYWORD1>catch</KEYWORD1>
			<KEYWORD1>center</KEYWORD1>
			<KEYWORD1>changestr</KEYWORD1>
			<KEYWORD1>compare</KEYWORD1>
			<KEYWORD1>copies</KEYWORD1>
			<KEYWORD1>countstr</KEYWORD1>
			<KEYWORD1>c2d</KEYWORD1>
			<KEYWORD1>c2x</KEYWORD1>
			<KEYWORD1>datatype</KEYWORD1>
			<KEYWORD1>delstr</KEYWORD1>
			<KEYWORD1>delword</KEYWORD1>
			<KEYWORD1>d2c</KEYWORD1>
			<KEYWORD1>d2X</KEYWORD1>
			<KEYWORD1>exists</KEYWORD1>
			<KEYWORD1>format</KEYWORD1>
			<KEYWORD1>insert</KEYWORD1>
			<KEYWORD1>lastpos</KEYWORD1>
			<KEYWORD1>left</KEYWORD1>
			<KEYWORD1>length</KEYWORD1>
			<KEYWORD1>lower</KEYWORD1>
			<KEYWORD1>max</KEYWORD1>
			<KEYWORD1>min</KEYWORD1>
			<KEYWORD1>overlay</KEYWORD1>
			<KEYWORD1>pos</KEYWORD1>
			<KEYWORD1>reverse</KEYWORD1>
			<KEYWORD1>right</KEYWORD1>
			<KEYWORD1>say</KEYWORD1>
			<KEYWORD1>sequence</KEYWORD1>
			<KEYWORD1>sign</KEYWORD1>
			<KEYWORD1>space</KEYWORD1>
			<KEYWORD1>strip</KEYWORD1>
			<KEYWORD1>substr</KEYWORD1>
			<KEYWORD1>subword</KEYWORD1>
			<KEYWORD1>trunc</KEYWORD1>
			<KEYWORD1>upper</KEYWORD1>
			<KEYWORD1>verify</KEYWORD1>
			<KEYWORD1>word</KEYWORD1>
			<KEYWORD1>wordindex</KEYWORD1>
			<KEYWORD1>wordlength</KEYWORD1>
			<KEYWORD1>wordpos</KEYWORD1>
			<KEYWORD1>words</KEYWORD1>
			<KEYWORD1>x2b</KEYWORD1>
			<KEYWORD1>x2c</KEYWORD1>
			<KEYWORD1>x2d</KEYWORD1>

			<KEYWORD2>do</KEYWORD2>
			<KEYWORD2>while</KEYWORD2>
			<KEYWORD2>if</KEYWORD2>
			<KEYWORD2>then</KEYWORD2>
			<KEYWORD2>else</KEYWORD2>
			<KEYWORD2>end</KEYWORD2>
			<KEYWORD2>select</KEYWORD2>
			<KEYWORD2>loop</KEYWORD2>
			<KEYWORD2>over</KEYWORD2>
			<KEYWORD2>iterate</KEYWORD2>
			<KEYWORD2>leave</KEYWORD2>
			<KEYWORD2>exit</KEYWORD2>
			<KEYWORD2>trace</KEYWORD2>
			<KEYWORD2>numeric</KEYWORD2>
			<KEYWORD2>options</KEYWORD2>
			<KEYWORD2>package</KEYWORD2>
			<KEYWORD2>import</KEYWORD2>
			<KEYWORD2>options</KEYWORD2>

			<KEYWORD3>method</KEYWORD3>
			<KEYWORD3>class</KEYWORD3>
			<KEYWORD3>properties</KEYWORD3>


		</KEYWORDS>
	</RULES>
</MODE>
